{
  "empresa": "Cofar Salud",
  "dominio": "cofar.cl",
  "fecha": "2026-09-12",
  "plataforma": {
    "nombre": "Next.js (App Router, Turbopack), desarrollo propio; backend de catálogo en services.cofar.cl (Railway); CDN CloudFront; CMS Strapi",
    "version": null,
    "evidencia": "header x-powered-by: Next.js y x-nextjs-prerender en evidencia/raw/home.headers; chunks /_next/static/chunks/turbopack-*.js y payload self.__next_f.push en evidencia/raw/home.html; NEXT_PUBLIC_API_URL=https://services.cofar.cl y rutas /mscontent/strapi/* en evidencia/js/_all.js; CNAME services.cofar.cl -> up.railway.app en evidencia/contacto/dns.txt"
  },
  "resumen": {
    "productos_publicos_aprox": 3024,
    "muestra_fichas": 60,
    "cobertura_jsonld_product_pct": 0.0,
    "cobertura_precio_jsonld_pct": 0.0,
    "gtin_validos_pct": null,
    "asimetria_atributos_max_pct": 69.3,
    "skus_datos_solo_en_nombre": 118,
    "catalogo_oculto_pct": 0.1,
    "fichas_una_sola_imagen_pct": 61.6,
    "contradicciones_contacto": 2,
    "enlaces_footer_404": 0,
    "robots_ok": true,
    "llms_txt_ok": false,
    "sitemap_ok": true,
    "catalogo_publico_con_precios": true,
    "api_catalogo_publica": "https://services.cofar.cl/products/2.0/?first=100&offset=0",
    "dom_verificado": true
  },
  "cobertura_atributos": [
    {
      "subcategoria": "Diabetes y obesidad",
      "n": 115,
      "atributos": {
        "principio_activo": 96.5,
        "concentracion_estructurada": 96.5,
        "laboratorio": 100.0,
        "forma_farmaceutica": 100.0,
        "cantidad_por_envase_estructurada": 100.0,
        "condicion_venta": 100.0,
        "condicion_almacenamiento": 100.0,
        "descripcion_40+": 27.0,
        "meta_description": 86.1,
        "2+_imagenes": 21.7
      }
    },
    {
      "subcategoria": "Oncológicos (subTag)",
      "n": 142,
      "atributos": {
        "principio_activo": 99.3,
        "concentracion_estructurada": 99.3,
        "laboratorio": 100.0,
        "forma_farmaceutica": 100.0,
        "cantidad_por_envase_estructurada": 100.0,
        "condicion_venta": 100.0,
        "condicion_almacenamiento": 100.0,
        "descripcion_40+": 4.2,
        "meta_description": 88.7,
        "2+_imagenes": 40.8
      }
    },
    {
      "subcategoria": "VIH",
      "n": 28,
      "atributos": {
        "principio_activo": 96.4,
        "concentracion_estructurada": 96.4,
        "laboratorio": 100.0,
        "forma_farmaceutica": 100.0,
        "cantidad_por_envase_estructurada": 100.0,
        "condicion_venta": 100.0,
        "condicion_almacenamiento": 100.0,
        "descripcion_40+": 0.0,
        "meta_description": 82.1,
        "2+_imagenes": 21.4
      }
    },
    {
      "subcategoria": "Fertilidad",
      "n": 19,
      "atributos": {
        "principio_activo": 94.7,
        "concentracion_estructurada": 94.7,
        "laboratorio": 100.0,
        "forma_farmaceutica": 100.0,
        "cantidad_por_envase_estructurada": 100.0,
        "condicion_venta": 100.0,
        "condicion_almacenamiento": 94.7,
        "descripcion_40+": 36.8,
        "meta_description": 63.2,
        "2+_imagenes": 5.3
      }
    },
    {
      "subcategoria": "Salud mental",
      "n": 462,
      "atributos": {
        "principio_activo": 97.4,
        "concentracion_estructurada": 97.4,
        "laboratorio": 100.0,
        "forma_farmaceutica": 100.0,
        "cantidad_por_envase_estructurada": 100.0,
        "condicion_venta": 100.0,
        "condicion_almacenamiento": 100.0,
        "descripcion_40+": 12.1,
        "meta_description": 99.6,
        "2+_imagenes": 53.7
      }
    },
    {
      "subcategoria": "Refrigerados",
      "n": 148,
      "atributos": {
        "principio_activo": 97.3,
        "concentracion_estructurada": 97.3,
        "laboratorio": 100.0,
        "forma_farmaceutica": 100.0,
        "cantidad_por_envase_estructurada": 100.0,
        "condicion_venta": 100.0,
        "condicion_almacenamiento": 100.0,
        "descripcion_40+": 6.8,
        "meta_description": 99.3,
        "2+_imagenes": 2.0
      }
    },
    {
      "subcategoria": "Hormona del crecimiento",
      "n": 5,
      "atributos": {
        "principio_activo": 100.0,
        "concentracion_estructurada": 100.0,
        "laboratorio": 100.0,
        "forma_farmaceutica": 100.0,
        "cantidad_por_envase_estructurada": 100.0,
        "condicion_venta": 100.0,
        "condicion_almacenamiento": 100.0,
        "descripcion_40+": 0.0,
        "meta_description": 100.0,
        "2+_imagenes": 0.0
      }
    },
    {
      "subcategoria": "Cardiovascular",
      "n": 341,
      "atributos": {
        "principio_activo": 98.2,
        "concentracion_estructurada": 98.2,
        "laboratorio": 100.0,
        "forma_farmaceutica": 100.0,
        "cantidad_por_envase_estructurada": 100.0,
        "condicion_venta": 100.0,
        "condicion_almacenamiento": 100.0,
        "descripcion_40+": 4.1,
        "meta_description": 96.5,
        "2+_imagenes": 30.5
      }
    },
    {
      "subcategoria": "Antiinfecciosos",
      "n": 191,
      "atributos": {
        "principio_activo": 96.9,
        "concentracion_estructurada": 96.9,
        "laboratorio": 100.0,
        "forma_farmaceutica": 100.0,
        "cantidad_por_envase_estructurada": 100.0,
        "condicion_venta": 100.0,
        "condicion_almacenamiento": 100.0,
        "descripcion_40+": 5.8,
        "meta_description": 99.5,
        "2+_imagenes": 36.1
      }
    },
    {
      "subcategoria": "Dolor y analgésicos",
      "n": 247,
      "atributos": {
        "principio_activo": 94.3,
        "concentracion_estructurada": 94.3,
        "laboratorio": 100.0,
        "forma_farmaceutica": 100.0,
        "cantidad_por_envase_estructurada": 100.0,
        "condicion_venta": 100.0,
        "condicion_almacenamiento": 99.6,
        "descripcion_40+": 33.6,
        "meta_description": 96.0,
        "2+_imagenes": 30.0
      }
    },
    {
      "subcategoria": "Vitaminas y suplementos (tipo)",
      "n": 203,
      "atributos": {
        "principio_activo": 21.2,
        "concentracion_estructurada": 21.2,
        "laboratorio": 100.0,
        "forma_farmaceutica": 100.0,
        "cantidad_por_envase_estructurada": 100.0,
        "condicion_venta": 100.0,
        "condicion_almacenamiento": 99.5,
        "descripcion_40+": 67.0,
        "meta_description": 69.5,
        "2+_imagenes": 68.5
      }
    },
    {
      "subcategoria": "Dermocosméticos (tipo)",
      "n": 75,
      "atributos": {
        "principio_activo": 0.0,
        "concentracion_estructurada": 0.0,
        "laboratorio": 1.3,
        "forma_farmaceutica": 100.0,
        "cantidad_por_envase_estructurada": 100.0,
        "condicion_venta": 100.0,
        "condicion_almacenamiento": 100.0,
        "descripcion_40+": 69.3,
        "meta_description": 86.7,
        "2+_imagenes": 56.0
      }
    },
    {
      "subcategoria": "Accesorios (tipo)",
      "n": 15,
      "atributos": {
        "principio_activo": 0.0,
        "concentracion_estructurada": 0.0,
        "laboratorio": 100.0,
        "forma_farmaceutica": 100.0,
        "cantidad_por_envase_estructurada": 100.0,
        "condicion_venta": 100.0,
        "condicion_almacenamiento": 100.0,
        "descripcion_40+": 26.7,
        "meta_description": 93.3,
        "2+_imagenes": 13.3
      }
    },
    {
      "subcategoria": "TODO el catálogo",
      "n": 3024,
      "atributos": {
        "principio_activo": 86.5,
        "concentracion_estructurada": 86.5,
        "laboratorio": 97.6,
        "forma_farmaceutica": 100.0,
        "cantidad_por_envase_estructurada": 100.0,
        "condicion_venta": 100.0,
        "condicion_almacenamiento": 99.9,
        "descripcion_40+": 20.6,
        "meta_description": 93.9,
        "2+_imagenes": 38.4
      }
    },
    {
      "subcategoria": "Solo medicamentos",
      "n": 2731,
      "atributos": {
        "principio_activo": 94.2,
        "concentracion_estructurada": 94.2,
        "laboratorio": 100.0,
        "forma_farmaceutica": 100.0,
        "cantidad_por_envase_estructurada": 100.0,
        "condicion_venta": 100.0,
        "condicion_almacenamiento": 99.9,
        "descripcion_40+": 15.8,
        "meta_description": 95.9,
        "2+_imagenes": 35.8
      }
    }
  ],
  "hallazgos": [
    {
      "id": "H01",
      "paso": 8,
      "titulo": "Las fichas no entregan ningún dato de producto a quien no ejecuta JavaScript",
      "gravedad": 5,
      "capa": "mixto",
      "descripcion": "En 50 de 50 fichas vivas muestreadas (10 estratos: diabetes, oncológicos, VIH, fertilidad, salud mental, refrigerados, cardiovascular, vitaminas, dermocosmética, receta cheque) el raw HTML contiene título, meta description (46/50) y canonical, pero cero precio, cero principio activo, cero laboratorio, cero descripción y cero imágenes de producto. Se revisó también el payload de Next.js (self.__next_f.push): tampoco están ahí (precio 0/50, principio activo 0/50, descripción 0/50). Estado de cada dato: AUSENTE en raw, no 'solo en script'. El navegador los obtiene después con una llamada a services.cofar.cl/products/2.0/{sku}. En el DOM renderizado con Chrome headless (21 fichas vivas) sí aparecen precio normal (21/21), precio oferta (8/8), SKU (21/21), laboratorio (19/21), principio activo (17/21) y condición de venta. Impacto: GPTBot, ClaudeBot, PerplexityBot, vistas previas de WhatsApp/Instagram/Facebook y cualquier lector sin JS solo pueden aprender el nombre del producto. La ironía es que el backend sí tiene todos esos datos estructurados (ver H03 y cobertura_atributos).",
      "cifra": "50 de 50 fichas sin precio, principio activo, laboratorio ni descripción en el HTML; 0 de 50 en el payload; 21 de 21 con todo en el DOM",
      "ejemplo_sku": "012522017 (Ozempic 2 mg/1,5 ml): raw = solo el título; DOM = $237.390 / $151.890, Semaglutida 2 mg/1,5 ml, Novo Nordisk, Rec. Med. Simple, Refrigerado",
      "evidencia": [